{"type":"config","name":"Optimize GCS XML/native read-write wall-clock time","metricName":"total_seconds","metricUnit":"s","bestDirection":"lower"}
{"run":1,"commit":"a8009cc","metric":0,"metrics":{},"status":"crash","description":"baseline harness failed to execute remote benchmark body","timestamp":1779147627358,"segment":0,"confidence":null,"asi":{"hypothesis":"Set up broad ch-builder benchmark for XML/native read-write paths","failure_mode":"kubectl exec omitted -i, so bash -s received no here-doc body and only the build/restart phase ran","rollback_reason":"No benchmark metrics were produced; pod had no /work/results/autoresearch_gcs_rw_* output directory","next_action_hint":"Add -i to kubectl exec for the remote benchmark here-doc and rerun baseline"}}
{"run":2,"commit":"a8009cc","metric":0,"metrics":{},"status":"crash","description":"second baseline attempt still did not run remote benchmark","timestamp":1779147793736,"segment":0,"confidence":null,"asi":{"hypothesis":"Remote benchmark should execute via stdin after build and restart","failure_mode":"autoresearch.sh still lacked kubectl exec -i after crash revert preserved the old script body; no /work/results/autoresearch_gcs_rw_* directory was created","rollback_reason":"No METRIC lines or benchmark output directory; only build/restart logs updated","next_action_hint":"Patch autoresearch.sh again, verify grep shows `kubectl exec -i`, then rerun baseline"}}
{"run":3,"commit":"c68dd64","metric":659.404,"metrics":{"real_read_seconds":288.278,"real_write_seconds":319.29,"small_read_seconds":31.699,"small_write_seconds":20.137,"native_seconds":217.817,"xml_seconds":258.759,"xml_64m20_seconds":182.828},"status":"keep","description":"successful broad baseline for GCS XML/native read-write suite","timestamp":1779148597828,"segment":0,"confidence":null,"asi":{"hypothesis":"Establish a broad non-overfit baseline covering real large part writes/reads and many-small-file writes/reads for xml, xml_64m20, and native","benchmark_scope":"real_write attaches 23.59 GiB source part to each object-storage disk; real_read scans heavy map/string columns; small workload copies and reads a 96-column local wide part","baseline_total_seconds":659.404,"best_initial_variant":"xml_64m20 has lowest aggregate path time; xml is slowest largely due real_write and small_read","next_action_hint":"Inspect source for low-risk parameter changes; first try XML configuration variant or native/XML read buffer/client tuning that plausibly helps both real and small workloads"}}
{"run":4,"commit":"c68dd64","metric":699.528,"metrics":{"real_read_seconds":342.506,"real_write_seconds":303.158,"small_read_seconds":34.539,"small_write_seconds":19.325,"native_seconds":232.053,"xml_seconds":270.538,"xml_64m20_seconds":196.937},"status":"discard","description":"increase native gRPC compose upload concurrency from 4 to 8","timestamp":1779149541428,"segment":0,"confidence":null,"asi":{"hypothesis":"More native GCS temporary-object upload concurrency could reduce native real_write wall time without affecting XML paths","outcome":"Primary regressed from 659.404s to 699.528s despite real_write improving by about 16s; read phases regressed enough to dominate","rollback_reason":"Higher native upload concurrency is not a broad win on this suite and may add noise/resource pressure","next_action_hint":"Do not simply raise native max_concurrent_uploads globally; focus on read path or XML policy/client settings next"}}
{"run":5,"commit":"dab1b17","metric":656.218,"metrics":{"real_read_seconds":314.423,"real_write_seconds":291.342,"small_read_seconds":31.026,"small_write_seconds":19.427,"native_seconds":210.166,"xml_seconds":254.833,"xml_64m20_seconds":191.219},"status":"keep","description":"skip extra-byte range validation when native GCS read consumed requested limit","timestamp":1779150352609,"segment":0,"confidence":205.96924042686524,"asi":{"hypothesis":"Avoiding an extra read/status-drain probe after an exactly satisfied native GCS range read could reduce per-object read overhead without changing requested bytes","outcome":"Primary improved slightly from 659.404s to 656.218s; native aggregate improved, mostly via write/small read, but real_read was noisier and worse than baseline","risk":"This removes strict detection of extra bytes after a requested range; validate correctness assumptions before finalizing upstream","next_action_hint":"Rerun this exact kept change to confirm because improvement is small and workload noise is visible"}}
{"run":6,"commit":"dab1b17","metric":690.048,"metrics":{"real_read_seconds":335.165,"real_write_seconds":303.053,"small_read_seconds":31.865,"small_write_seconds":19.965,"native_seconds":230.012,"xml_seconds":277.747,"xml_64m20_seconds":182.289},"status":"discard","description":"confirmation rerun of native range-close validation change","timestamp":1779151155503,"segment":0,"confidence":38.795033993496844,"asi":{"hypothesis":"Repeat the previous kept native read close change to check whether the small primary improvement was stable","outcome":"Rerun regressed to 690.048s; previous 656.218s result was likely noise or workload variance","rollback_reason":"No additional code change in this iteration; do not treat the prior small improvement as confirmed","next_action_hint":"Consider reverting the prior commit if future runs do not show benefit; prioritize larger, safer gains"}}
{"run":7,"commit":"dab1b17","metric":732.229,"metrics":{"real_read_seconds":371.746,"real_write_seconds":306.077,"small_read_seconds":34.09,"small_write_seconds":20.316,"native_seconds":277.269,"xml_seconds":270.215,"xml_64m20_seconds":184.745},"status":"discard","description":"revert native range extra-byte validation skip","timestamp":1779152041623,"segment":0,"confidence":21.414240960710085,"asi":{"hypothesis":"Restoring strict native GCS range close validation may remove correctness risk and test whether the previous change was actually helping","outcome":"Suite was much slower at 732.229s, driven by native real_read outlier; not useful as an optimization iteration","rollback_reason":"Primary metric regressed significantly versus the current kept state","next_action_hint":"Keep the current range-close change for now as an experimental state, but revisit its correctness risk before final review"}}
{"run":8,"commit":"984a4ec","metric":623.56,"metrics":{"real_read_seconds":337.275,"real_write_seconds":230.735,"small_read_seconds":35.164,"small_write_seconds":20.386,"native_seconds":210.889,"xml_seconds":219.544,"xml_64m20_seconds":193.127},"status":"keep","description":"use 64MiB XML multipart defaults for native GCS XML writes","timestamp":1779152944000,"segment":0,"confidence":28.795197413992106,"asi":{"hypothesis":"Default native GCS XML multipart should use the same 64MiB single/strict part size policy that won the real-part upload benchmark, unless explicitly overridden","outcome":"Primary improved materially to 623.560s. Real write fell from 319.290s baseline to 230.735s, mostly because default xml real_write dropped from about 140.8s to 74.0s","tradeoff":"Read phases were noisy and worse in this run, but write improvement was large enough to dominate the broad suite","next_action_hint":"Confirm that explicit query/disk settings can still override this default; consider adding config-specific XML policy names later instead of hard-coding if needed"}}
{"run":9,"commit":"cf79972","metric":577.403,"metrics":{"real_read_seconds":309.184,"real_write_seconds":212.88,"small_read_seconds":33.593,"small_write_seconds":21.746,"native_seconds":193.048,"xml_seconds":186.361,"xml_64m20_seconds":197.994},"status":"keep","description":"raise native GCS compose upload concurrency from 4 to 6","timestamp":1779153672166,"segment":0,"confidence":16.108776922218482,"asi":{"hypothesis":"A moderate native gRPC compose upload concurrency increase can reduce native real_write without the resource-pressure regression seen at 8","outcome":"Primary improved to 577.403s. Native real_write dropped to 71.921s, comparable to XML 64MiB writes, and aggregate native path dropped to 193.048s","tradeoff":"small_write regressed slightly, especially xml_64m20, likely benchmark noise or object-store contention; real_write gain dominates","next_action_hint":"Try native concurrency 7 or tune compose chunking only if read noise remains controlled; 8 was previously too aggressive"}}
{"run":10,"commit":"7b17b4e","metric":566.429,"metrics":{"real_read_seconds":298.547,"real_write_seconds":215.637,"small_read_seconds":31.974,"small_write_seconds":20.271,"native_seconds":195.943,"xml_seconds":183.582,"xml_64m20_seconds":186.904},"status":"keep","description":"raise native GCS compose upload concurrency from 6 to 7","timestamp":1779154382868,"segment":0,"confidence":14.91230518112888,"asi":{"hypothesis":"Native compose upload concurrency 7 may retain write throughput while avoiding the earlier concurrency-8 resource pressure","outcome":"Primary improved to 566.429s, mostly from better real_read noise and small_read/native path while real_write stayed near 216s","tradeoff":"Native real_write was slightly slower than concurrency 6 in this run, so improvement is not purely from native upload; benchmark noise remains substantial","next_action_hint":"Try concurrency 8 again on top of XML default changes or focus on XML read settings; validate with repeated run before finalizing concurrency"}}
{"run":11,"commit":"7b17b4e","metric":573.937,"metrics":{"real_read_seconds":302.635,"real_write_seconds":218.233,"small_read_seconds":33.238,"small_write_seconds":19.831,"native_seconds":189.787,"xml_seconds":196.641,"xml_64m20_seconds":187.509},"status":"discard","description":"raise native GCS compose upload concurrency from 7 to 8","timestamp":1779155092353,"segment":0,"confidence":13.078480720387883,"asi":{"hypothesis":"Concurrency 8 might improve native write further after XML default policy improvements","outcome":"Primary regressed from 566.429s to 573.937s. Native aggregate improved but XML real/read noise and real_write totals worsened","rollback_reason":"Concurrency 8 is not a broad win; previous 7 remains better for the suite","next_action_hint":"Keep native max_concurrent_uploads at 7 for now; avoid further simple concurrency increases"}}
{"run":12,"commit":"7b17b4e","metric":667.05,"metrics":{"real_read_seconds":366.804,"real_write_seconds":246.293,"small_read_seconds":33.455,"small_write_seconds":20.498,"native_seconds":217.427,"xml_seconds":179.826,"xml_64m20_seconds":269.797},"status":"discard","description":"parallelize native GCS temporary object cleanup deletes","timestamp":1779155936843,"segment":0,"confidence":14.91230518112888,"asi":{"hypothesis":"Deleting native GCS compose temporary objects concurrently could reduce native write tail latency after compose","outcome":"Primary regressed to 667.050s and real_write worsened; parallel delete did not help the broad suite","rollback_reason":"Likely extra thread/object-store pressure or delete phase not the bottleneck; added complexity without benefit","next_action_hint":"Do not parallelize cleanup this way; inspect upload/compose timing before attempting native write-tail changes"}}
{"run":13,"commit":"7b17b4e","metric":676.787,"metrics":{"real_read_seconds":374.613,"real_write_seconds":250.782,"small_read_seconds":31.393,"small_write_seconds":19.999,"native_seconds":221.247,"xml_seconds":258.725,"xml_64m20_seconds":196.815},"status":"discard","description":"try 128MiB default native GCS XML multipart policy","timestamp":1779156753362,"segment":0,"confidence":15.802616895435754,"asi":{"hypothesis":"Larger 128MiB XML multipart chunks might further reduce part count and improve real writes compared with 64MiB defaults","outcome":"Primary regressed to 676.787s; xml aggregate worsened sharply and real_write worsened versus 64MiB default","rollback_reason":"128MiB default is too large or noisier for the broad suite; 64MiB remains the better default","next_action_hint":"Try 32MiB default only if exploring policy curve; otherwise keep 64MiB"}}
{"run":14,"commit":"7b17b4e","metric":633.277,"metrics":{"real_read_seconds":307.872,"real_write_seconds":271.32,"small_read_seconds":33.359,"small_write_seconds":20.726,"native_seconds":225.533,"xml_seconds":218.133,"xml_64m20_seconds":189.611},"status":"discard","description":"try 32MiB default native GCS XML multipart policy","timestamp":1779157515729,"segment":0,"confidence":17.038533269161338,"asi":{"hypothesis":"A 32MiB XML default may trade slightly more upload parts for better read/object layout and lower memory pressure","outcome":"Primary regressed to 633.277s; real_write worsened too much compared with 64MiB default","rollback_reason":"32MiB default is not a broad win for the read/write suite","next_action_hint":"Keep 64MiB default; policy curve suggests 64MiB is the local optimum among 32/64/128"}}
{"run":15,"commit":"7b17b4e","metric":0,"metrics":{"real_read_seconds":0,"real_write_seconds":0,"small_read_seconds":0,"small_write_seconds":0,"native_seconds":0,"xml_seconds":0,"xml_64m20_seconds":0},"status":"crash","description":"parallelize native GCS compose groups failed to compile","timestamp":1779157696780,"segment":0,"confidence":17.038533269161338,"asi":{"hypothesis":"Parallel first-level GCS compose operations could reduce native write tail time for large objects with many compose groups","failure_mode":"Build failed with -Wshadow-uncaptured-local because lambda init-captures `group` and `intermediate` shadowed local variables","rollback_reason":"Compile error before benchmark","next_action_hint":"Rename lambda captures to captured_group and captured_intermediate if retrying compose parallelism"}}
{"run":16,"commit":"7b17b4e","metric":701.8,"metrics":{"real_read_seconds":409.8,"real_write_seconds":235.033,"small_read_seconds":36.403,"small_write_seconds":20.564,"native_seconds":237.546,"xml_seconds":264.615,"xml_64m20_seconds":199.639},"status":"discard","description":"parallelize native GCS intermediate compose groups","timestamp":1779158529632,"segment":0,"confidence":15.802616895435754,"asi":{"hypothesis":"Parallelizing independent first-level GCS compose operations could reduce native write tail latency after uploads complete","outcome":"Primary regressed to 701.800s; real_write did not improve enough and read phases were much worse/noisy","rollback_reason":"Compose parallelism adds complexity and is not a broad win in the suite","next_action_hint":"Do not pursue compose parallelism without finer per-phase native write instrumentation"}}
{"run":17,"commit":"7b17b4e","metric":630.874,"metrics":{"real_read_seconds":366.382,"real_write_seconds":211.564,"small_read_seconds":33.128,"small_write_seconds":19.8,"native_seconds":270.451,"xml_seconds":178.471,"xml_64m20_seconds":181.952},"status":"discard","description":"align GCS XML HTTP client connection settings with S3 disk defaults","timestamp":1779159358749,"segment":0,"confidence":17.038533269161338,"asi":{"hypothesis":"Setting XML multipart client max connections and keepalive parameters to S3 disk defaults could reduce XML upload overhead","outcome":"XML path metrics improved, but primary regressed to 630.874s due a large native real_read outlier unrelated to XML writes","rollback_reason":"Primary metric regressed; cannot keep on this broad suite despite promising XML secondary metrics","next_action_hint":"Consider retesting this change with repeated runs or a write-focused suite if XML-only optimization is desired"}}
{"run":18,"commit":"7b17b4e","metric":586.1,"metrics":{"real_read_seconds":314.454,"real_write_seconds":218.179,"small_read_seconds":33.041,"small_write_seconds":20.426,"native_seconds":199.588,"xml_seconds":193.548,"xml_64m20_seconds":192.964},"status":"discard","description":"increase native GCS sequential read window multiplier from 16 to 32","timestamp":1779160128619,"segment":0,"confidence":16.7433934377771,"asi":{"hypothesis":"Larger native GCS range windows could reduce GET count and per-read overhead for sequential reads","outcome":"Primary regressed to 586.100s; real_read did not improve enough and write phases were similar/noisy","rollback_reason":"Doubling sequential range window is not a broad win; possible extra bytes or unchanged access pattern offsets benefit","next_action_hint":"Do not blindly increase read windows; inspect GET count/read bytes before trying adaptive range coalescing"}}
{"run":19,"commit":"ec3e5f8","metric":565.417,"metrics":{"real_read_seconds":290.981,"real_write_seconds":222.589,"small_read_seconds":31.314,"small_write_seconds":20.533,"native_seconds":189.583,"xml_seconds":194.176,"xml_64m20_seconds":181.658},"status":"keep","description":"reduce native GCS sequential read window multiplier from 16 to 8","timestamp":1779160828546,"segment":0,"confidence":11.299187657997008,"asi":{"hypothesis":"Smaller native GCS sequential range windows may avoid over-reading and reduce latency for sparse MergeTree range reads while preserving enough streaming","outcome":"Primary improved slightly to 565.417s; real_read improved versus the previous kept state, but real_write was noisier/slower","tradeoff":"Small improvement is close to benchmark noise; confirm later before relying on it","next_action_hint":"Try multiplier 4 or rerun multiplier 8 for confirmation; inspect read bytes/GET counts if available"}}
{"run":20,"commit":"ec3e5f8","metric":628.932,"metrics":{"real_read_seconds":277.835,"real_write_seconds":299.858,"small_read_seconds":30.548,"small_write_seconds":20.691,"native_seconds":263.592,"xml_seconds":180.272,"xml_64m20_seconds":185.068},"status":"discard","description":"reduce native GCS sequential read window multiplier from 8 to 4","timestamp":1779161598056,"segment":0,"confidence":11.985013883884092,"asi":{"hypothesis":"Even smaller native GCS read windows might further reduce sparse-read overfetch","outcome":"real_read improved but real_write/native aggregate regressed heavily; primary worsened to 628.932s","rollback_reason":"Multiplier 4 is not a broad read/write win under the current suite","next_action_hint":"Keep multiplier 8; further read-window tuning should use read-focused diagnostics rather than primary suite alone"}}
{"run":21,"commit":"ec3e5f8","metric":580.173,"metrics":{"real_read_seconds":285.669,"real_write_seconds":242.838,"small_read_seconds":31.751,"small_write_seconds":19.915,"native_seconds":203.94,"xml_seconds":184.082,"xml_64m20_seconds":192.151},"status":"discard","description":"set native GCS sequential read window multiplier to 12","timestamp":1779162311180,"segment":0,"confidence":11.553505384253862,"asi":{"hypothesis":"Read window multiplier 12 might balance the overfetch reduction of 8 with fewer GETs than 8","outcome":"Primary regressed to 580.173s versus kept multiplier 8; no clear broad benefit","rollback_reason":"Multiplier 12 is worse than current kept multiplier 8","next_action_hint":"Keep multiplier 8 as best tested among 4/8/12/16/32"}}
{"run":22,"commit":"e2cac09","metric":540.773,"metrics":{"real_read_seconds":280.938,"real_write_seconds":208.07,"small_read_seconds":31.469,"small_write_seconds":20.296,"native_seconds":181.81,"xml_seconds":180.728,"xml_64m20_seconds":178.235},"status":"keep","description":"avoid reopening native GCS streams for buffered and small forward seeks","timestamp":1779163490620,"segment":0,"confidence":10.665923749038477,"asi":{"hypothesis":"Mirroring S3 seek behavior in native GCS reads should reduce object stream reopen churn for MergeTree mark/range reads by seeking within buffered data or ignoring small forward gaps","outcome":"Primary improved materially to 540.773s. All major phase totals improved versus previous kept state, especially real_write/noise and real_read","mechanism":"GCSReadBuffer::seek now reuses the current buffer and reads through small forward seeks below remote_read_min_bytes_for_seek instead of always resetSequentialStream","next_action_hint":"Confirm with a repeat or inspect GCSReadObject counts; consider applying the same buffered-seek logic to edge cases/tests"}}
{"run":23,"commit":"e2cac09","metric":634.819,"metrics":{"real_read_seconds":365.676,"real_write_seconds":217.227,"small_read_seconds":31.944,"small_write_seconds":19.972,"native_seconds":191.235,"xml_seconds":220.263,"xml_64m20_seconds":223.321},"status":"discard","description":"confirmation rerun of native GCS buffered/small-forward seek reuse","timestamp":1779164238975,"segment":0,"confidence":11.049939720877006,"asi":{"hypothesis":"Repeat the kept native GCS seek reuse change to check stability","outcome":"Primary regressed to 634.819 because xml/xml_64 real_read were outliers, but native aggregate remained good at 191.235s","rollback_reason":"No code change in this iteration; discard the noisy confirmation datapoint","next_action_hint":"The native seek change still looks plausible because native read remained strong; future benchmark should reduce XML read noise or use medians"}}
{"run":24,"commit":"e2cac09","metric":606.795,"metrics":{"real_read_seconds":330.415,"real_write_seconds":223.582,"small_read_seconds":32.983,"small_write_seconds":19.815,"native_seconds":213.979,"xml_seconds":184.226,"xml_64m20_seconds":208.59},"status":"discard","description":"retest S3-disk HTTP defaults for GCS XML client after seek optimization","timestamp":1779164966067,"segment":0,"confidence":11.778210964214926,"asi":{"hypothesis":"XML client S3-disk connection defaults may improve XML write paths, and previous rejection may have been native read noise","outcome":"Primary still regressed to 606.795. XML aggregate was decent but xml_64/native read noise and real_write did not beat current kept state","rollback_reason":"Not a broad win under the current benchmark","next_action_hint":"Do not keep HTTP default alignment unless a future write-focused benchmark justifies it separately"}}
