{"run":25,"commit":"e2cac09","metric":0,"metrics":{"real_read_seconds":0,"real_write_seconds":0,"small_read_seconds":0,"small_write_seconds":0,"native_seconds":0,"xml_seconds":0,"xml_64m20_seconds":0},"status":"crash","description":"use 64MiB native GCS temporary compose objects failed to compile","timestamp":1779165217204,"segment":0,"confidence":11.778210964214926,"asi":{"hypothesis":"Using 64MiB native compose temporary objects could reduce native object count and compose overhead, similar to XML 64MiB policy","failure_mode":"Build failed because max_write_chunk_bytes became unused under -Werror after switching threshold/chunking to max_temporary_object_bytes","rollback_reason":"Compile error before benchmark","next_action_hint":"Retry by removing unused max_write_chunk_bytes or by using it in a static_assert/comment-free way if the 64MiB temp object experiment remains promising"}}
{"run":26,"commit":"e2cac09","metric":0,"metrics":{"real_read_seconds":0,"real_write_seconds":0,"small_read_seconds":0,"small_write_seconds":0,"native_seconds":0,"xml_seconds":0,"xml_64m20_seconds":0},"status":"crash","description":"64MiB native temporary object retry missed constant declaration","timestamp":1779165437500,"segment":0,"confidence":11.778210964214926,"asi":{"hypothesis":"Retry 64MiB native temporary objects after removing unused max_write_chunk_bytes","failure_mode":"Edit did not replace the constant declaration, so max_temporary_object_bytes was undeclared while uses were changed","rollback_reason":"Compile error before benchmark","next_action_hint":"Replace the declaration line directly with max_temporary_object_bytes before rerunning"}}
{"run":27,"commit":"e2cac09","metric":556.284,"metrics":{"real_read_seconds":282.644,"real_write_seconds":219.765,"small_read_seconds":33.53,"small_write_seconds":20.345,"native_seconds":185.972,"xml_seconds":184.562,"xml_64m20_seconds":185.75},"status":"discard","description":"use 64MiB native GCS temporary compose objects","timestamp":1779166136171,"segment":0,"confidence":11.194505972219345,"asi":{"hypothesis":"Larger 64MiB native temporary objects should reduce compose source count and tail overhead for native large writes","outcome":"Primary regressed to 556.284 versus current kept 540.773; native aggregate was close but real_write did not improve","rollback_reason":"64MiB native temp objects are not a net win in the broad suite","next_action_hint":"Keep native temp objects at the Google client/service chunk size; native write appears better served by concurrency 7 and seek optimization"}}
{"run":28,"commit":"e2cac09","metric":611.018,"metrics":{"real_read_seconds":323.716,"real_write_seconds":236.756,"small_read_seconds":30.737,"small_write_seconds":19.809,"native_seconds":214.844,"xml_seconds":198.216,"xml_64m20_seconds":197.958},"status":"discard","description":"double native GCS small-forward seek threshold","timestamp":1779166879689,"segment":0,"confidence":11.300240309267576,"asi":{"hypothesis":"Reading through larger forward gaps could reduce native GCS stream reopen churn beyond the default remote_read_min_bytes_for_seek","outcome":"Primary regressed to 611.018 and native aggregate worsened; more over-reading likely outweighed fewer stream resets","rollback_reason":"Do not multiply remote_read_min_bytes_for_seek for GCS by default","next_action_hint":"Keep the setting-respecting threshold; if tuning, expose a config rather than hard-code"}}
{"run":29,"commit":"e2cac09","metric":596.017,"metrics":{"real_read_seconds":293.564,"real_write_seconds":250.62,"small_read_seconds":31.597,"small_write_seconds":20.236,"native_seconds":223.268,"xml_seconds":191.14,"xml_64m20_seconds":181.609},"status":"discard","description":"halve native GCS small-forward seek threshold","timestamp":1779167600172,"segment":0,"confidence":12.449163760258765,"asi":{"hypothesis":"A smaller read-through threshold might avoid over-reading while still preserving buffered-seek reuse","outcome":"Primary regressed to 596.017; native aggregate worsened mainly from write/noise and no meaningful read win","rollback_reason":"Halving remote_read_min_bytes_for_seek is not a broad win","next_action_hint":"Keep default threshold with buffered/small-forward seek support"}}
